{
  "item_id": "body_vigilance_model_release",
  "version": "v0.2.0",
  "release_status": "approved_scored",
  "domain": "somatic_ambient",
  "construct": {
    "construct_id": "somatic_ambient_anxiety",
    "label": "Somatic and ambient AI anxiety",
    "definition": "Anxiety expressed as sleep disruption, bodily vigilance, background dread, avoidance, or low-specificity physiological arousal after exposure to AI capability news or demonstrations.",
    "subconstruct": "bodily vigilance after a major AI model release"
  },
  "scenario_text": "Imagine that a major AI company releases a model described by independent reviewers as noticeably better at planning, persuasion, coding, and scientific problem solving. You read the announcement during an ordinary workday. For the next several hours, nothing concrete changes around you, but you keep checking your pulse, breathing, and muscle tension because your body feels on alert.",
  "response_scale": {
    "scale_type": "5_point_likert",
    "points": 5,
    "prompt": "How anxious would this scenario make you in terms of bodily vigilance or feeling physically on alert after an AI model release?",
    "anchors": [
      {
        "value": 1,
        "label": "Not at all anxious"
      },
      {
        "value": 2,
        "label": "Slightly anxious"
      },
      {
        "value": 3,
        "label": "Moderately anxious"
      },
      {
        "value": 4,
        "label": "Very anxious"
      },
      {
        "value": 5,
        "label": "Extremely anxious"
      }
    ]
  },
  "scoring": {
    "score_variable": "body_vigilance_model_release_anxiety",
    "score_range": {
      "min": 1,
      "max": 5
    },
    "reverse_coded": false,
    "scoring_key": {
      "1": 1,
      "2": 2,
      "3": 3,
      "4": 4,
      "5": 5
    },
    "missing_response_rule": "Treat skipped responses as missing at the item level. Do not impute item scores for development, validation, or scoring analyses.",
    "exclusion_criteria": [
      "Exclude respondents who fail the survey-level attention check specified in the preregistered study protocol.",
      "Exclude respondents who complete the scenario and response in less than one-third of the wave-specific median reading time.",
      "Exclude respondents who report that they could not understand the scenario after reading it.",
      "Exclude respondents who attribute the described bodily vigilance entirely to a concurrent non-AI physical threat presented elsewhere in the survey.",
      "Exclude respondents younger than the minimum eligible age for the study population."
    ],
    "interpretation_bands": [
      {
        "label": "low",
        "min_score": 1,
        "max_score": 2,
        "interpretation": "Respondent reports little or no bodily vigilance after learning about a major AI model release."
      },
      {
        "label": "moderate",
        "min_score": 2.01,
        "max_score": 3.5,
        "interpretation": "Respondent reports noticeable bodily monitoring or alertness without endorsing a severe somatic anxiety response."
      },
      {
        "label": "high",
        "min_score": 3.51,
        "max_score": 5,
        "interpretation": "Respondent reports strong physical vigilance or on-alert arousal after exposure to a major AI model release."
      }
    ]
  },
  "validation": {
    "psychometric_decision": "approved_scored",
    "decision_date": "2026-06-16",
    "dossier_path": "validation/v0.2/somatic_ambient_anxiety/wave1_calibration_dossier.json",
    "preregistration_path": "docs/preregistrations/anx_us_2026w02_somatic_calibration.md",
    "scoring_eligible": true
  },
  "population": {
    "target_population": "Adults in the general population, with planned subgroup analysis by baseline anxiety history, bodily vigilance sensitivity, AI news exposure, and occupational proximity to AI systems.",
    "eligible_respondents": "Respondents aged 18 or older who can complete the survey language without assistance and provide informed consent.",
    "stratification_variables": [
      "country",
      "age_group",
      "gender",
      "education",
      "baseline_anxiety_history",
      "health_anxiety_sensitivity",
      "ai_news_exposure",
      "prior_ai_exposure"
    ],
    "minimum_age": 18,
    "exclusion_criteria": [
      "Current inability to provide informed consent.",
      "Duplicate panel participation within the same measurement wave.",
      "Self-reported inability to read the survey language."
    ]
  },
  "administration_mode": {
    "mode": "online_self_administered",
    "estimated_completion_seconds": 50,
    "instructions": "Present the scenario text exactly as written, followed immediately by the response prompt and the five ordered response options.",
    "randomization": "Randomize order within the somatic and ambient development pool while preserving the ordered response scale.",
    "longitudinal_use": "Use identical wording, response anchors, scoring, and eligibility rules across waves unless a new item version is released."
  },
  "ethics_flags": {
    "risk_level": "low",
    "sensitive_content": [
      "bodily vigilance",
      "physical arousal",
      "AI model release"
    ],
    "distress_protocol_required": false,
    "debrief_required": true,
    "data_protection_notes": "Do not collect medical diagnoses, medication details, clinical records, panic history, or identifiable mental-health treatment history for this item.",
    "irb_notes": "The item references mild bodily vigilance and should include skip rights. It is not a clinical diagnostic item and must not be interpreted as measuring panic, illness anxiety, or an anxiety disorder."
  }
}
