{
  "item_id": "ambient_bodily_unease",
  "version": "v0.1.0",
  "release_status": "development_only",
  "domain": "somatic_ambient",
  "construct": {
    "construct_id": "somatic_ambient_ai_anxiety_anchor",
    "label": "Somatic and ambient AI anxiety anchor",
    "definition": "Anxiety arising from diffuse bodily unease, vigilance, sleep disruption, or background physiological arousal after exposure to AI capability news or AI-mediated environments.",
    "subconstruct": "ambient bodily unease after AI news exposure"
  },
  "scenario_text": "Imagine that during the same week you read several credible news stories about AI systems passing difficult exams, producing realistic video, automating parts of professional work, and being tested in hospitals, schools, and public agencies. None of the stories directly affects your job or family. Still, later that evening you notice a tight chest, restless attention, and difficulty settling down because the news makes the future feel less predictable.",
  "response_scale": {
    "scale_type": "5_point_likert",
    "points": 5,
    "prompt": "How anxious would this scenario make you in terms of bodily unease or background tension after AI news exposure?",
    "anchors": [
      {
        "value": 1,
        "label": "Not at all anxious"
      },
      {
        "value": 2,
        "label": "Slightly anxious"
      },
      {
        "value": 3,
        "label": "Moderately anxious"
      },
      {
        "value": 4,
        "label": "Very anxious"
      },
      {
        "value": 5,
        "label": "Extremely anxious"
      }
    ]
  },
  "scoring": {
    "score_variable": "ambient_bodily_unease_anxiety",
    "score_range": {
      "min": 1,
      "max": 5
    },
    "reverse_coded": false,
    "scoring_key": {
      "1": 1,
      "2": 2,
      "3": 3,
      "4": 4,
      "5": 5
    },
    "missing_response_rule": "Treat skipped responses as missing at the item level. Do not impute single-item scores for primary analyses.",
    "exclusion_criteria": [
      "Exclude respondents who fail the survey-level attention check specified in the study protocol.",
      "Exclude respondents who complete the item in less than one-third of the median reading time for the administration wave.",
      "Exclude respondents who report that they could not understand the scenario after reading it.",
      "Exclude respondents younger than the minimum eligible age for the study population."
    ],
    "interpretation_bands": [
      {
        "label": "low",
        "min_score": 1.0,
        "max_score": 2.0,
        "interpretation": "Respondent reports little or no anxiety-related bodily unease after exposure to broad AI capability news."
      },
      {
        "label": "moderate",
        "min_score": 2.01,
        "max_score": 3.5,
        "interpretation": "Respondent reports a meaningful but not severe anxiety response involving diffuse bodily tension or unsettled attention."
      },
      {
        "label": "high",
        "min_score": 3.51,
        "max_score": 5.0,
        "interpretation": "Respondent reports strong ambient or somatic anxiety in response to cumulative AI capability news and future uncertainty."
      }
    ]
  },
  "validation": {
    "psychometric_decision": "development_only",
    "decision_date": "2026-06-15",
    "dossier_path": "not_available",
    "preregistration_path": "not_available",
    "scoring_eligible": false
  },
  "population": {
    "target_population": "Adults in the general population, with planned subgroup analysis by baseline anxiety history, news exposure, health-anxiety sensitivity, and frequency of AI-related media consumption.",
    "eligible_respondents": "Respondents aged 18 or older who can complete the survey language without assistance and provide informed consent.",
    "stratification_variables": [
      "country",
      "age_group",
      "gender",
      "education",
      "baseline_anxiety_history",
      "ai_news_exposure",
      "prior_ai_exposure"
    ],
    "minimum_age": 18,
    "exclusion_criteria": [
      "Current inability to provide informed consent.",
      "Duplicate panel participation within the same measurement wave.",
      "Self-reported inability to read the survey language."
    ]
  },
  "administration_mode": {
    "mode": "online_self_administered",
    "estimated_completion_seconds": 50,
    "instructions": "Present the scenario text exactly as written, followed immediately by the response prompt and the five ordered response options.",
    "randomization": "Randomize item order within the cross-domain anchor pool while preserving the ordered response scale.",
    "longitudinal_use": "Use identical wording, response anchors, scoring, and eligibility rules across waves unless a new item version is released."
  },
  "ethics_flags": {
    "risk_level": "low",
    "sensitive_content": [
      "bodily anxiety symptoms",
      "news exposure",
      "future uncertainty"
    ],
    "distress_protocol_required": false,
    "debrief_required": true,
    "data_protection_notes": "Do not collect medical diagnoses, medication details, clinical records, or identifiable mental-health treatment history for this item.",
    "irb_notes": "The item references mild bodily anxiety symptoms and should include a reminder that respondents may skip items. It is not a clinical diagnostic item and should not be interpreted as measuring an anxiety disorder."
  }
}
