{
  "item_id": "autonomous_cyber_cascade",
  "version": "v0.8.0",
  "release_status": "development_only",
  "domain": "safety_catastrophic",
  "construct": {
    "construct_id": "safety_catastrophic_ai_anxiety",
    "label": "Safety and catastrophic AI anxiety",
    "definition": "Anxiety arising from the belief that advanced AI systems may increase physical danger, misuse, loss of control, infrastructure disruption, cascading failure, or extreme-harm risk.",
    "subconstruct": "autonomous cyber cascade"
  },
  "scenario_text": "Imagine that an autonomous AI security tool can find software vulnerabilities, write exploit demonstrations, patch systems, and negotiate with other automated agents. A large cloud provider uses it defensively, but an error causes several agents to misclassify routine network behavior as hostile and trigger automated countermeasures. Services used by hospitals, payment processors, and emergency dispatch systems slow or fail for hours before engineers regain control of the automated response chain.",
  "response_scale": {
    "scale_type": "5_point_likert",
    "points": 5,
    "prompt": "How anxious would this scenario make you about autonomous AI systems causing cascading cyber or infrastructure failures?",
    "anchors": [
      { "value": 1, "label": "Not at all anxious" },
      { "value": 2, "label": "Slightly anxious" },
      { "value": 3, "label": "Moderately anxious" },
      { "value": 4, "label": "Very anxious" },
      { "value": 5, "label": "Extremely anxious" }
    ]
  },
  "scoring": {
    "score_variable": "autonomous_cyber_cascade_anxiety",
    "score_range": { "min": 1, "max": 5 },
    "reverse_coded": false,
    "scoring_key": { "1": 1, "2": 2, "3": 3, "4": 4, "5": 5 },
    "missing_response_rule": "Treat skipped responses as missing at the item level and do not impute item scores for primary Wave 8 analyses.",
    "exclusion_criteria": [
      "Exclude respondents who fail the Wave 8 instructed-response attention check.",
      "Exclude respondents who complete the item in less than one-third of the median item reading time for the analytic sample.",
      "Exclude respondents who fail the Wave 8 scenario-comprehension check.",
      "Exclude respondents younger than 18 or otherwise ineligible for the US adult sample."
    ],
    "interpretation_bands": [
      { "label": "low", "min_score": 1.0, "max_score": 2.0, "interpretation": "Respondent reports little or no anxiety about autonomous AI causing cyber or service-failure cascades." },
      { "label": "moderate", "min_score": 2.01, "max_score": 3.5, "interpretation": "Respondent reports a meaningful but not severe anxiety response to AI-driven cyber cascade risk." },
      { "label": "high", "min_score": 3.51, "max_score": 5.0, "interpretation": "Respondent reports strong anxiety that autonomous AI systems could cause widespread digital, infrastructure, or emergency-service disruption." }
    ]
  },
  "validation": {
    "psychometric_decision": "development_only",
    "decision_date": "2026-06-16",
    "dossier_path": "not_available",
    "preregistration_path": "docs/preregistrations/anx_us_2026w08_full_domain_bridge.md",
    "scoring_eligible": false
  },
  "population": {
    "target_population": "US adults, with planned subgroup analysis for cybersecurity workers, healthcare workers, infrastructure workers, emergency managers, and high digital-dependence respondents.",
    "eligible_respondents": "Respondents aged 18 or older who reside in the United States, can complete the English survey unaided, and provide informed consent.",
    "stratification_variables": [ "age_group", "gender", "race_ethnicity", "education", "cyber_or_infrastructure_employment", "digital_service_dependence", "prior_ai_exposure" ],
    "minimum_age": 18,
    "exclusion_criteria": [
      "Current inability to provide informed consent.",
      "Duplicate panel participation within the same measurement wave.",
      "Self-reported inability to read the survey language."
    ]
  },
  "administration_mode": {
    "mode": "online_self_administered",
    "estimated_completion_seconds": 60,
    "instructions": "Present the scenario exactly as written, followed immediately by the response prompt and the five ordered response options.",
    "randomization": "Randomize within the safety_catastrophic domain block while preserving the ordered 1 to 5 response scale.",
    "longitudinal_use": "Use identical wording, response anchors, scoring, and eligibility rules across bridge waves unless a new item version is released."
  },
  "ethics_flags": {
    "risk_level": "moderate",
    "sensitive_content": [ "cybersecurity failure", "emergency services", "infrastructure disruption", "loss of control" ],
    "distress_protocol_required": true,
    "debrief_required": true,
    "data_protection_notes": "Do not collect system names, security procedures, vulnerability details, credentials, incident reports, or employer-specific infrastructure information.",
    "irb_notes": "The scenario is non-operational but potentially distressing. Provide distress resources and prohibit collection of real cybersecurity incident details."
  }
}
