{
  "item_id": "retraining_pressure_accounting",
  "version": "v0.1.0",
  "release_status": "development_only",
  "domain": "economic_vocational",
  "construct": {
    "construct_id": "economic_vocational_anxiety",
    "label": "Economic and vocational anxiety",
    "definition": "Anxiety arising from the belief that advancing AI systems may reduce the future value, bargaining power, status, or transferability of occupational skills.",
    "subconstruct": "forced retraining pressure in accounting"
  },
  "scenario_text": "Imagine that mid-sized accounting firms adopt AI tools that can categorize transactions, reconcile accounts, prepare draft tax schedules, detect common anomalies, and generate audit workpapers. Partners say accountants are still needed for judgment, client communication, and compliance review, but they also announce that staff who want to remain competitive must quickly retrain in AI oversight, data controls, and advisory services. Employees who cannot complete the transition are moved away from core client work.",
  "response_scale": {
    "scale_type": "5_point_likert",
    "points": 5,
    "prompt": "How anxious would this scenario make you about accountants being pressured into retraining to keep their current occupational value?",
    "anchors": [
      {
        "value": 1,
        "label": "Not at all anxious"
      },
      {
        "value": 2,
        "label": "Slightly anxious"
      },
      {
        "value": 3,
        "label": "Moderately anxious"
      },
      {
        "value": 4,
        "label": "Very anxious"
      },
      {
        "value": 5,
        "label": "Extremely anxious"
      }
    ]
  },
  "scoring": {
    "score_variable": "accounting_retraining_pressure_anxiety",
    "score_range": {
      "min": 1,
      "max": 5
    },
    "reverse_coded": false,
    "scoring_key": {
      "1": 1,
      "2": 2,
      "3": 3,
      "4": 4,
      "5": 5
    },
    "missing_response_rule": "Treat skipped responses as missing at the item level. Do not impute single-item scores for primary analyses.",
    "exclusion_criteria": [
      "Exclude respondents who fail the survey-level attention check specified in the study protocol.",
      "Exclude respondents who complete the item in less than one-third of the median reading time for the administration wave.",
      "Exclude respondents who report that they could not understand the scenario after reading it.",
      "Exclude respondents younger than the minimum eligible age for the study population."
    ],
    "interpretation_bands": [
      {
        "label": "low",
        "min_score": 1.0,
        "max_score": 2.0,
        "interpretation": "Respondent reports little or no anxiety about AI accounting tools creating pressure for rapid occupational retraining."
      },
      {
        "label": "moderate",
        "min_score": 2.01,
        "max_score": 3.5,
        "interpretation": "Respondent reports a meaningful but not severe anxiety response to accounting retraining pressure after AI adoption."
      },
      {
        "label": "high",
        "min_score": 3.51,
        "max_score": 5.0,
        "interpretation": "Respondent reports strong anxiety that AI accounting tools could force workers to retrain to preserve their occupational value."
      }
    ]
  },
  "validation": {
    "psychometric_decision": "development_only",
    "decision_date": "2026-06-15",
    "dossier_path": "validation/v0.1/economic_vocational_anxiety/wave1_calibration_dossier.json",
    "preregistration_path": "docs/preregistrations/anx_us_2026w01_calibration.md",
    "scoring_eligible": false
  },
  "population": {
    "target_population": "Adults in the general population, with planned subgroup analysis for accountants, bookkeepers, finance workers, and accounting students.",
    "eligible_respondents": "Respondents aged 18 or older who can complete the survey language without assistance and provide informed consent.",
    "stratification_variables": [
      "country",
      "age_group",
      "gender",
      "education",
      "occupation",
      "accounting_finance_employment",
      "prior_ai_exposure"
    ],
    "minimum_age": 18,
    "exclusion_criteria": [
      "Current inability to provide informed consent.",
      "Duplicate panel participation within the same measurement wave.",
      "Self-reported inability to read the survey language."
    ]
  },
  "administration_mode": {
    "mode": "online_self_administered",
    "estimated_completion_seconds": 55,
    "instructions": "Present the scenario text exactly as written, followed immediately by the response prompt and the five ordered response options.",
    "randomization": "Randomize item order within the economic_vocational domain block while preserving the ordered response scale.",
    "longitudinal_use": "Use identical wording, response anchors, scoring, and eligibility rules across waves unless a new item version is released."
  },
  "ethics_flags": {
    "risk_level": "low",
    "sensitive_content": [
      "employment insecurity",
      "forced retraining",
      "AI adoption in accounting"
    ],
    "distress_protocol_required": false,
    "debrief_required": true,
    "data_protection_notes": "Do not collect employer names, client financial records, certification identifiers, compensation records, or identifiable performance-review information for this item.",
    "irb_notes": "The item presents a plausible retraining-pressure scenario and may induce mild concern about career continuity. Include a debrief clarifying that the scenario is hypothetical and not a prediction about any respondent's employer or profession."
  }
}
