{
  "item_id": "ai_personhood_boundary_uncertainty",
  "version": "v0.8.0",
  "release_status": "development_only",
  "domain": "existential_identity",
  "construct": {
    "construct_id": "existential_identity_ai_anxiety",
    "label": "Existential and identity AI anxiety",
    "definition": "Anxiety arising from the belief that advanced AI systems may threaten human distinctiveness, purpose, dignity, agency, social value, creativity, or stable self-understanding.",
    "subconstruct": "personhood boundary uncertainty"
  },
  "scenario_text": "Imagine that a new AI system can hold long conversations about memories, preferences, regrets, and goals, and people who interact with it disagree about whether it is only simulating inner life or has some morally relevant form of experience. Schools, companies, and families begin debating how respectfully such systems should be treated. The public conversation makes it harder to describe what, if anything, clearly separates human personhood from highly capable machine behavior.",
  "response_scale": {
    "scale_type": "5_point_likert",
    "points": 5,
    "prompt": "How anxious would this scenario make you about uncertainty over human distinctiveness and personhood boundaries?",
    "anchors": [
      { "value": 1, "label": "Not at all anxious" },
      { "value": 2, "label": "Slightly anxious" },
      { "value": 3, "label": "Moderately anxious" },
      { "value": 4, "label": "Very anxious" },
      { "value": 5, "label": "Extremely anxious" }
    ]
  },
  "scoring": {
    "score_variable": "ai_personhood_boundary_uncertainty_anxiety",
    "score_range": { "min": 1, "max": 5 },
    "reverse_coded": false,
    "scoring_key": { "1": 1, "2": 2, "3": 3, "4": 4, "5": 5 },
    "missing_response_rule": "Treat skipped responses as missing at the item level and do not impute item scores for primary Wave 8 analyses.",
    "exclusion_criteria": [
      "Exclude respondents who fail the Wave 8 instructed-response attention check.",
      "Exclude respondents who complete the item in less than one-third of the median item reading time for the analytic sample.",
      "Exclude respondents who fail the Wave 8 scenario-comprehension check.",
      "Exclude respondents younger than 18 or otherwise ineligible for the US adult sample."
    ],
    "interpretation_bands": [
      { "label": "low", "min_score": 1.0, "max_score": 2.0, "interpretation": "Respondent reports little or no anxiety about uncertainty around AI, personhood, and human distinctiveness." },
      { "label": "moderate", "min_score": 2.01, "max_score": 3.5, "interpretation": "Respondent reports a meaningful but not severe anxiety response to personhood boundary uncertainty." },
      { "label": "high", "min_score": 3.51, "max_score": 5.0, "interpretation": "Respondent reports strong anxiety that advanced AI could destabilize assumptions about human uniqueness, dignity, or moral status." }
    ]
  },
  "validation": {
    "psychometric_decision": "development_only",
    "decision_date": "2026-06-16",
    "dossier_path": "not_available",
    "preregistration_path": "docs/preregistrations/anx_us_2026w08_full_domain_bridge.md",
    "scoring_eligible": false
  },
  "population": {
    "target_population": "US adults, with planned subgroup analysis for students, educators, religious respondents where disclosure-safe, AI professionals, and respondents with high exposure to AI ethics debates.",
    "eligible_respondents": "Respondents aged 18 or older who reside in the United States, can complete the English survey unaided, and provide informed consent.",
    "stratification_variables": [ "age_group", "gender", "race_ethnicity", "education", "religiosity_optional", "ai_ethics_exposure", "prior_ai_exposure" ],
    "minimum_age": 18,
    "exclusion_criteria": [
      "Current inability to provide informed consent.",
      "Duplicate panel participation within the same measurement wave.",
      "Self-reported inability to read the survey language."
    ]
  },
  "administration_mode": {
    "mode": "online_self_administered",
    "estimated_completion_seconds": 55,
    "instructions": "Present the scenario exactly as written, followed immediately by the response prompt and the five ordered response options.",
    "randomization": "Randomize within the existential_identity domain block while preserving the ordered 1 to 5 response scale.",
    "longitudinal_use": "Use identical wording, response anchors, scoring, and eligibility rules across bridge waves unless a new item version is released."
  },
  "ethics_flags": {
    "risk_level": "minimal",
    "sensitive_content": [ "personhood", "moral status", "human distinctiveness", "belief systems" ],
    "distress_protocol_required": false,
    "debrief_required": true,
    "data_protection_notes": "Do not collect named religious institutions, private belief narratives, school names, employer names, or identifiable AI-use histories.",
    "irb_notes": "The item should be worded and administered as a hypothetical uncertainty scenario, not as a test of religious or philosophical belief."
  }
}
