{
  "item_id": "deepfake_evidence_trust",
  "version": "v0.1.0",
  "release_status": "development_only",
  "domain": "epistemic",
  "construct": {
    "construct_id": "epistemic_trust_anxiety",
    "label": "Epistemic trust anxiety",
    "definition": "Anxiety arising from the belief that advancing AI systems may make ordinary evidence, testimony, media records, or institutional fact-finding harder to trust.",
    "subconstruct": "deepfake evidence trust erosion"
  },
  "scenario_text": "Imagine that a local court case depends on a phone video that appears to show a public official accepting a bribe. Within hours, several AI tools produce expert-looking analyses that disagree about whether the video, audio, and metadata are genuine. News organizations, the court, and the public all have access to detection systems, but each system gives a different confidence score and none can provide a decisive answer before the case shapes public opinion.",
  "response_scale": {
    "scale_type": "5_point_likert",
    "points": 5,
    "prompt": "How anxious would this scenario make you about being able to trust digital evidence in important public decisions?",
    "anchors": [
      {
        "value": 1,
        "label": "Not at all anxious"
      },
      {
        "value": 2,
        "label": "Slightly anxious"
      },
      {
        "value": 3,
        "label": "Moderately anxious"
      },
      {
        "value": 4,
        "label": "Very anxious"
      },
      {
        "value": 5,
        "label": "Extremely anxious"
      }
    ]
  },
  "scoring": {
    "score_variable": "deepfake_evidence_trust_anxiety",
    "score_range": {
      "min": 1,
      "max": 5
    },
    "reverse_coded": false,
    "scoring_key": {
      "1": 1,
      "2": 2,
      "3": 3,
      "4": 4,
      "5": 5
    },
    "missing_response_rule": "Treat skipped responses as missing at the item level. Do not impute single-item scores for primary analyses.",
    "exclusion_criteria": [
      "Exclude respondents who fail the survey-level attention check specified in the study protocol.",
      "Exclude respondents who complete the item in less than one-third of the median reading time for the administration wave.",
      "Exclude respondents who report that they could not understand the scenario after reading it.",
      "Exclude respondents younger than the minimum eligible age for the study population."
    ],
    "interpretation_bands": [
      {
        "label": "low",
        "min_score": 1.0,
        "max_score": 2.0,
        "interpretation": "Respondent reports little or no anxiety about AI-generated media weakening trust in digital evidence."
      },
      {
        "label": "moderate",
        "min_score": 2.01,
        "max_score": 3.5,
        "interpretation": "Respondent reports a meaningful but not severe anxiety response to uncertainty about AI-mediated evidence authenticity."
      },
      {
        "label": "high",
        "min_score": 3.51,
        "max_score": 5.0,
        "interpretation": "Respondent reports strong anxiety that AI-generated or AI-contested media could undermine reliable public fact-finding."
      }
    ]
  },
  "validation": {
    "psychometric_decision": "development_only",
    "decision_date": "2026-06-15",
    "dossier_path": "validation/v0.6/epistemic_trust_anxiety/wave6_calibration_dossier.json",
    "preregistration_path": "docs/preregistrations/anx_us_2026w06_epistemic_calibration.md",
    "scoring_eligible": false
  },
  "population": {
    "target_population": "Adults in the general population, with planned subgroup analysis for journalists, legal professionals, public-sector workers, and respondents with high news exposure.",
    "eligible_respondents": "Respondents aged 18 or older who can complete the survey language without assistance and provide informed consent.",
    "stratification_variables": [
      "country",
      "age_group",
      "gender",
      "education",
      "media_literacy",
      "legal_or_journalism_employment",
      "prior_ai_exposure"
    ],
    "minimum_age": 18,
    "exclusion_criteria": [
      "Current inability to provide informed consent.",
      "Duplicate panel participation within the same measurement wave.",
      "Self-reported inability to read the survey language."
    ]
  },
  "administration_mode": {
    "mode": "online_self_administered",
    "estimated_completion_seconds": 55,
    "instructions": "Present the scenario text exactly as written, followed immediately by the response prompt and the five ordered response options.",
    "randomization": "Randomize item order within the cross-domain anchor pool while preserving the ordered response scale.",
    "longitudinal_use": "Use identical wording, response anchors, scoring, and eligibility rules across waves unless a new item version is released."
  },
  "ethics_flags": {
    "risk_level": "low",
    "sensitive_content": [
      "public corruption allegation",
      "digital misinformation",
      "legal evidence uncertainty"
    ],
    "distress_protocol_required": false,
    "debrief_required": true,
    "data_protection_notes": "Do not collect names of real court cases, officials, witnesses, journalists, or private allegations in response to this item.",
    "irb_notes": "The item describes a hypothetical evidence-authenticity dispute and may induce concern about public trust. Include a debrief clarifying that the scenario is fictional and is not a claim about any real case."
  }
}
