{
  "item_id": "sleep_disruption_ai_news",
  "version": "v0.2.0",
  "release_status": "approved_scored",
  "domain": "somatic_ambient",
  "construct": {
    "construct_id": "somatic_ambient_anxiety",
    "label": "Somatic and ambient AI anxiety",
    "definition": "Anxiety expressed as sleep disruption, bodily vigilance, background dread, avoidance, or low-specificity physiological arousal after exposure to AI capability news or demonstrations.",
    "subconstruct": "sleep disruption after AI capability news"
  },
  "scenario_text": "Imagine that shortly before bed you read credible coverage of a new AI system that can independently plan tasks, write convincing messages, and operate common software tools. The story does not say that you personally will lose work or be harmed. Still, when you try to sleep, you keep replaying the implications and feel too keyed up to settle for more than an hour.",
  "response_scale": {
    "scale_type": "5_point_likert",
    "points": 5,
    "prompt": "How anxious would this scenario make you in terms of sleep disruption or difficulty settling after AI news exposure?",
    "anchors": [
      {
        "value": 1,
        "label": "Not at all anxious"
      },
      {
        "value": 2,
        "label": "Slightly anxious"
      },
      {
        "value": 3,
        "label": "Moderately anxious"
      },
      {
        "value": 4,
        "label": "Very anxious"
      },
      {
        "value": 5,
        "label": "Extremely anxious"
      }
    ]
  },
  "scoring": {
    "score_variable": "sleep_disruption_ai_news_anxiety",
    "score_range": {
      "min": 1,
      "max": 5
    },
    "reverse_coded": false,
    "scoring_key": {
      "1": 1,
      "2": 2,
      "3": 3,
      "4": 4,
      "5": 5
    },
    "missing_response_rule": "Treat skipped responses as missing at the item level. Do not impute item scores for development, validation, or scoring analyses.",
    "exclusion_criteria": [
      "Exclude respondents who fail the survey-level attention check specified in the preregistered study protocol.",
      "Exclude respondents who complete the scenario and response in less than one-third of the wave-specific median reading time.",
      "Exclude respondents who report that they could not understand the scenario after reading it.",
      "Exclude respondents who report an acute unrelated sleep disruption that began before the AI news exposure scenario.",
      "Exclude respondents younger than the minimum eligible age for the study population."
    ],
    "interpretation_bands": [
      {
        "label": "low",
        "min_score": 1,
        "max_score": 2,
        "interpretation": "Respondent reports little or no anxiety-linked sleep disruption in response to late-evening AI capability news."
      },
      {
        "label": "moderate",
        "min_score": 2.01,
        "max_score": 3.5,
        "interpretation": "Respondent reports a meaningful but not severe anxiety response involving difficulty settling after AI news."
      },
      {
        "label": "high",
        "min_score": 3.51,
        "max_score": 5,
        "interpretation": "Respondent reports strong anxiety-linked arousal that would substantially interfere with sleep after AI capability news."
      }
    ]
  },
  "validation": {
    "psychometric_decision": "approved_scored",
    "decision_date": "2026-06-16",
    "dossier_path": "validation/v0.2/somatic_ambient_anxiety/wave1_calibration_dossier.json",
    "preregistration_path": "docs/preregistrations/anx_us_2026w02_somatic_calibration.md",
    "scoring_eligible": true
  },
  "population": {
    "target_population": "Adults in the general population, with planned subgroup analysis by baseline anxiety history, sleep sensitivity, AI news exposure, and prior use of AI systems.",
    "eligible_respondents": "Respondents aged 18 or older who can complete the survey language without assistance and provide informed consent.",
    "stratification_variables": [
      "country",
      "age_group",
      "gender",
      "education",
      "baseline_anxiety_history",
      "sleep_sensitivity",
      "ai_news_exposure",
      "prior_ai_exposure"
    ],
    "minimum_age": 18,
    "exclusion_criteria": [
      "Current inability to provide informed consent.",
      "Duplicate panel participation within the same measurement wave.",
      "Self-reported inability to read the survey language."
    ]
  },
  "administration_mode": {
    "mode": "online_self_administered",
    "estimated_completion_seconds": 50,
    "instructions": "Present the scenario text exactly as written, followed immediately by the response prompt and the five ordered response options.",
    "randomization": "Randomize order within the somatic and ambient development pool while preserving the ordered response scale.",
    "longitudinal_use": "Use identical wording, response anchors, scoring, and eligibility rules across waves unless a new item version is released."
  },
  "ethics_flags": {
    "risk_level": "low",
    "sensitive_content": [
      "sleep disruption",
      "bodily arousal",
      "future uncertainty"
    ],
    "distress_protocol_required": false,
    "debrief_required": true,
    "data_protection_notes": "Do not collect medical diagnoses, medication details, clinical records, sleep-disorder diagnoses, or identifiable mental-health treatment history for this item.",
    "irb_notes": "The item references mild sleep disruption and should include skip rights. It is not a clinical diagnostic item and must not be interpreted as measuring insomnia or an anxiety disorder."
  }
}
