{
  "item_id": "ai_expert_claim_conflict",
  "version": "v0.1.0",
  "release_status": "development_only",
  "domain": "epistemic",
  "construct": {
    "construct_id": "epistemic_trust_anxiety",
    "label": "Epistemic trust anxiety",
    "definition": "Anxiety arising from the belief that advancing AI systems may make ordinary evidence, testimony, media records, expert claims, provenance signals, or institutional fact-finding harder to trust.",
    "subconstruct": "conflicting AI-mediated expert claims"
  },
  "scenario_text": "Imagine that a public health agency, a hospital network, and several university experts are asked to evaluate a new environmental risk in drinking water. Each group uses advanced AI systems to review studies, inspect local data, and draft recommendations. The reports sound authoritative but reach different conclusions about whether the risk is serious. Human experts disagree about which AI analysis is most trustworthy, and the technical explanations are too complex for most residents to evaluate before they must decide what guidance to follow.",
  "response_scale": {
    "scale_type": "5_point_likert",
    "points": 5,
    "prompt": "How anxious would this scenario make you about knowing which expert claims to trust when AI systems support conflicting conclusions?",
    "anchors": [
      {
        "value": 1,
        "label": "Not at all anxious"
      },
      {
        "value": 2,
        "label": "Slightly anxious"
      },
      {
        "value": 3,
        "label": "Moderately anxious"
      },
      {
        "value": 4,
        "label": "Very anxious"
      },
      {
        "value": 5,
        "label": "Extremely anxious"
      }
    ]
  },
  "scoring": {
    "score_variable": "ai_expert_claim_conflict_anxiety",
    "score_range": {
      "min": 1,
      "max": 5
    },
    "reverse_coded": false,
    "scoring_key": {
      "1": 1,
      "2": 2,
      "3": 3,
      "4": 4,
      "5": 5
    },
    "missing_response_rule": "Treat skipped responses as missing at the item level. Do not impute single-item scores for primary analyses.",
    "exclusion_criteria": [
      "Exclude respondents who fail the survey-level attention check specified in the study protocol.",
      "Exclude respondents who complete the item in less than one-third of the median reading time for the administration wave.",
      "Exclude respondents who report that they could not understand the scenario after reading it.",
      "Exclude respondents younger than the minimum eligible age for the study population."
    ],
    "interpretation_bands": [
      {
        "label": "low",
        "min_score": 1.0,
        "max_score": 2.0,
        "interpretation": "Respondent reports little or no anxiety about AI-supported experts reaching conflicting claims."
      },
      {
        "label": "moderate",
        "min_score": 2.01,
        "max_score": 3.5,
        "interpretation": "Respondent reports a meaningful but not severe anxiety response to disagreement among AI-supported expert systems and human reviewers."
      },
      {
        "label": "high",
        "min_score": 3.51,
        "max_score": 5.0,
        "interpretation": "Respondent reports strong anxiety that AI-mediated expertise could make public guidance harder to evaluate and trust."
      }
    ]
  },
  "validation": {
    "psychometric_decision": "development_only",
    "decision_date": "2026-06-15",
    "dossier_path": "validation/v0.6/epistemic_trust_anxiety/wave6_calibration_dossier.json",
    "preregistration_path": "docs/preregistrations/anx_us_2026w06_epistemic_calibration.md",
    "scoring_eligible": false
  },
  "population": {
    "target_population": "Adults in the general population, with planned subgroup analysis for health care workers, public-sector workers, educators, and respondents with high institutional trust or low institutional trust.",
    "eligible_respondents": "Respondents aged 18 or older who can complete the survey language without assistance and provide informed consent.",
    "stratification_variables": [
      "country",
      "age_group",
      "gender",
      "education",
      "institutional_trust",
      "health_or_science_employment",
      "prior_ai_exposure"
    ],
    "minimum_age": 18,
    "exclusion_criteria": [
      "Current inability to provide informed consent.",
      "Duplicate panel participation within the same measurement wave.",
      "Self-reported inability to read the survey language."
    ]
  },
  "administration_mode": {
    "mode": "online_self_administered",
    "estimated_completion_seconds": 60,
    "instructions": "Present the scenario text exactly as written, followed immediately by the response prompt and the five ordered response options.",
    "randomization": "Randomize item order within the full ANX-Bench block while preserving the ordered response scale.",
    "longitudinal_use": "Use identical wording, response anchors, scoring, and eligibility rules across waves unless a new item version is released."
  },
  "ethics_flags": {
    "risk_level": "low",
    "sensitive_content": [
      "public health guidance",
      "environmental risk",
      "expert disagreement"
    ],
    "distress_protocol_required": false,
    "debrief_required": true,
    "data_protection_notes": "Do not collect respondent medical information, local water-system identifiers, employer names, or details about real environmental exposures in response to this item.",
    "irb_notes": "The item describes a hypothetical dispute among AI-supported expert reports and may induce mild concern about public guidance. Include a debrief clarifying that the scenario is fictional and does not describe a known local hazard."
  }
}
